,Metric,State,2010,2011,2012,2013,2014,2015,2016,2017,2018,2019
2,House Heating Fuel: Electric,NV,288359,320235,321747,323768,351476,361369,369932,393340,417183,413115
3,House Heating Fuel: Fuel Oil,NV,8664,6691,7231,6665,5896,6529,7190,7045,5834,5404
4,House Heating Fuel: Gas,NV,638719,605079,627705,621978,611388,622936,623652,639476,646974,664388
5,House Heating Fuel: Propane,NV,31061,28705,26371,27742,27175,25153,28287,27839,26003,29867
6,House Heating Fuel: Wood,NV,15273,13633,15907,13813,17073,14312,13487,14295,17336,14014
