,Metric,State,2010,2011,2012,2013,2014,2015,2016,2017,2018,2019
2,House Heating Fuel: Electric,VA,1514678,1544516,1604379,1625037,1653956,1687103,1699116,1708026,1757556,1793634
3,House Heating Fuel: Fuel Oil,VA,208176,193983,178393,168558,162273,153039,146013,140235,139770,131931
4,House Heating Fuel: Gas,VA,1027967,1015166,1016029,1020268,1023682,1029797,1032532,1041717,1054657,1041958
5,House Heating Fuel: Propane,VA,138687,130965,136651,137668,138787,134535,141229,137068,131055,135500
6,House Heating Fuel: Wood,VA,83925,85610,85135,82334,82114,79382,74887,69309,66813,60480
