,Metric,State,2010,2011,2012,2013,2014,2015,2016,2017,2018,2019
2,House Heating Fuel: Electric,KY,835138,824169,860605,868659,883857,889890,898114,901970,911907,921242
3,House Heating Fuel: Fuel Oil,KY,20121,20656,15485,15839,15956,15589,14744,14545,14000,12525
4,House Heating Fuel: Gas,KY,655820,653976,655998,645906,638201,643384,639630,643422,636965,644977
5,House Heating Fuel: Propane,KY,111306,111448,113175,108051,106636,104751,105573,100860,110523,108053
6,House Heating Fuel: Wood,KY,49069,48585,49406,51434,52310,46453,43963,47810,43532,48551
