,Metric,State,County,2010,2011,2012,2013,2014,2015,2016,2017,2018,2019
3,House Heating Fuel: Electric,DC,District of C,77900,82443,85799,90403,96194,103527,109239,113208,118948,122592
4,House Heating Fuel: Fuel Oil,DC,District of C,9407,8358,7765,7026,6556,5982,5338,4842,4187,3747
5,House Heating Fuel: Gas,DC,District of C,163727,163172,161857,159892,158089,156637,154256,151447,149614,148954
6,House Heating Fuel: Propane,DC,District of C,2925,2789,2443,2704,2497,2708,2707,2926,2948,2929
7,House Heating Fuel: Wood,DC,District of C,65,55,55,39,26,27,16,22,21,16
