,Metric,State,2010,2011,2012,2013,2014,2015,2016,2017,2018,2019
2,House Heating Fuel: Electric,MS,564029,591471,600806,602503,603699,614013,610496,620169,634392,638273
3,House Heating Fuel: Fuel Oil,MS,1863,1796,1565,1319,1067,2122,2470,3032,3171,1503
4,House Heating Fuel: Gas,MS,347171,330395,331549,338085,339414,338181,343978,330678,329840,317472
5,House Heating Fuel: Propane,MS,146694,136201,135562,128930,129561,130201,114510,122558,123545,125039
6,House Heating Fuel: Wood,MS,17256,17645,16701,14648,17236,14941,14521,10490,12482,13671
