,Metric,State,2010,2011,2012,2013,2014,2015,2016,2017,2018,2019
2,House Heating Fuel: Electric,SD,85447,89439,92135,99973,97069,101989,109209,111476,109872,114940
3,House Heating Fuel: Fuel Oil,SD,9105,10902,7806,8111,8253,6671,6854,7317,5712,5362
4,House Heating Fuel: Gas,SD,155638,156765,156813,156501,160121,162018,155319,161222,161455,164029
5,House Heating Fuel: Propane,SD,53407,55101,54015,52307,53817,53053,50018,51864,55267,57650
6,House Heating Fuel: Wood,SD,7259,5408,6133,5240,6959,6677,5699,5105,6415,4959
