,Metric,State,2010,2011,2012,2013,2014,2015,2016,2017,2018,2019
2,House Heating Fuel: Electric,ID,183522,191360,189786,196590,194895,201596,204797,204963,212296,225718
3,House Heating Fuel: Fuel Oil,ID,13320,11233,10232,9764,10243,8511,8601,7477,10065,9851
4,House Heating Fuel: Gas,ID,301227,293858,303445,296247,303196,307083,317194,329995,334824,333883
5,House Heating Fuel: Propane,ID,31483,29016,27523,30365,27837,27508,29878,32187,31162,33933
6,House Heating Fuel: Wood,ID,40437,48446,46012,46389,48610,45444,41276,43339,44366,43627
