,Metric,State,2010,2011,2012,2013,2014,2015,2016,2017,2018,2019
2,House Heating Fuel: Electric,IN,659543,667930,690543,717335,710158,726852,740225,764022,777784,772790
3,House Heating Fuel: Fuel Oil,IN,29396,24780,23066,21055,18946,18388,16749,16008,16551,16238
4,House Heating Fuel: Gas,IN,1527016,1521983,1510771,1504232,1515413,1517830,1521013,1525035,1548536,1552483
5,House Heating Fuel: Propane,IN,179701,174851,176520,176348,181828,177999,177100,179223,184265,184697
6,House Heating Fuel: Wood,IN,53848,54510,57554,55561,54170,51692,56087,48935,47601,44677
